Poker Hand #ring_852919959: NLH No Limit ($1/$2) - 2025/05/01 20:38:23
Table 'MR NLH 1/2' 7-max Seat #5 is the button
Seat 4: f3800e29 ($446.88 in chips)
Seat 5: 627c4124 ($247.71 in chips)
Seat 2: Hero ($258.74 in chips)
Hero: posts small blind $1
f3800e29: posts big blind $2
*** HOLE CARDS ***
Dealt to f3800e29 
Dealt to 627c4124 
Dealt to Hero [Ac Ts]
627c4124: raises $3 to $5
Hero: calls $4
f3800e29: folds
*** FLOP *** [Ks 7h 6s]
Hero: checks
627c4124: bets $4.08
Hero: calls $4.08
*** TURN *** [Ks 7h 6s] [6d]
Hero: checks
627c4124: checks
*** RIVER *** [Ks 7h 6s 6d] [3d]
Hero: bets $6.05
627c4124: calls $6.05
Hero: shows [Ac Ts]
627c4124: shows [4h 4d]
*** SHOWDOWN ***
627c4124 collected $32.26 from pot
*** SUMMARY ***
Total pot $32.26
Board [Ks 7h 6s 6d 3d]
Seat 4: f3800e29(big blind) folded before Flop
Seat 5: 627c4124 showed [4h 4d] and won ($32.26) with Pair of Sixes and Pair of Fours
Seat 2: Hero(small blind) showed [Ac Ts] and lost with Pair of Sixes



Poker Hand #ring_852918608: NLH No Limit ($1/$2) - 2025/05/01 20:37:32
Table 'MR NLH 1/2' 7-max Seat #4 is the button
Seat 4: f3800e29 ($450.88 in chips)
Seat 5: 627c4124 ($248.71 in chips)
Seat 3: d8b54539 ($345.51 in chips)
Seat 2: Hero ($209.42 in chips)
627c4124: posts small blind $1
Hero: posts big blind $2
*** HOLE CARDS ***
Dealt to f3800e29 
Dealt to 627c4124 
Dealt to d8b54539 
Dealt to Hero [9s Kh]
d8b54539: calls $2
f3800e29: raises $2 to $4
627c4124: folds
Hero: calls $2
d8b54539: calls $2
*** FLOP *** [7c 6h Qd]
Hero: bets $6.5
d8b54539: calls $6.5
f3800e29: folds
*** TURN *** [7c 6h Qd] [Tc]
Hero: bets $13
d8b54539: calls $13
*** RIVER *** [7c 6h Qd Tc] [8h]
Hero: bets $26
d8b54539: calls $26
Hero: shows [9s Kh]
d8b54539: shows [Td 8s]
*** SHOWDOWN ***
Hero collected $104 from pot
*** SUMMARY ***
Total pot $104
Board [7c 6h Qd Tc 8h]
Seat 4: f3800e29 folded on the Flop
Seat 5: 627c4124(small blind) folded before Flop
Seat 3: d8b54539 showed [Td 8s] and lost with Pair of Tens and Pair of Eights
Seat 2: Hero(big blind) showed [9s Kh] and won ($104) with Tens-High Straight



Poker Hand #ring_852917133: NLH No Limit ($1/$2) - 2025/05/01 20:36:35
Table 'MR NLH 1/2' 7-max Seat #3 is the button
Seat 4: f3800e29 ($451.88 in chips)
Seat 5: 627c4124 ($240.02 in chips)
Seat 3: d8b54539 ($354.01 in chips)
Seat 2: Hero ($209.42 in chips)
f3800e29: posts small blind $1
627c4124: posts big blind $2
*** HOLE CARDS ***
Dealt to f3800e29 
Dealt to 627c4124 
Dealt to d8b54539 
Dealt to Hero [2c Jc]
Hero: folds
d8b54539: raises $2 to $4
f3800e29: folds
627c4124: calls $2
*** FLOP *** [2s 9d Jd]
627c4124: checks
d8b54539: bets $4.5
627c4124: calls $4.5
*** TURN *** [2s 9d Jd] [Tc]
627c4124: checks
d8b54539: checks
*** RIVER *** [2s 9d Jd Tc] [Ks]
627c4124: bets $13.32
d8b54539: folds
Uncalled bet ($13.32) returned to 627c4124
*** SHOWDOWN ***
627c4124 collected $18 from pot
*** SUMMARY ***
Total pot $18
Board [2s 9d Jd Tc Ks]
Seat 4: f3800e29(small blind) folded before Flop
Seat 5: 627c4124(big blind)won ($18) with Kings-High Straight
Seat 3: d8b54539 folded on the River
Seat 2: Hero folded before Flop (didn't bet)



Poker Hand #ring_852915470: NLH No Limit ($1/$2) - 2025/05/01 20:35:31
Table 'MR NLH 1/2' 7-max Seat #2 is the button
Seat 4: f3800e29 ($457.88 in chips)
Seat 5: 627c4124 ($240.02 in chips)
Seat 3: d8b54539 ($355.01 in chips)
Seat 2: Hero ($203 in chips)
d8b54539: posts small blind $1
f3800e29: posts big blind $2
*** HOLE CARDS ***
Dealt to f3800e29 
Dealt to 627c4124 
Dealt to d8b54539 
Dealt to Hero [Js Jh]
627c4124: folds
Hero: raises $4 to $6
d8b54539: folds
f3800e29: calls $4
*** FLOP *** [3c Qd 6d]
f3800e29: checks
Hero: bets $6.5
f3800e29: folds
Uncalled bet ($6.5) returned to Hero
*** SHOWDOWN ***
Hero collected $13 from pot
*** SUMMARY ***
Total pot $13
Board [3c Qd 6d]
Seat 4: f3800e29(big blind) folded on the Flop
Seat 5: 627c4124 folded before Flop (didn't bet)
Seat 3: d8b54539(small blind) folded before Flop
Seat 2: Herowon ($13) with Pair of Jacks



Poker Hand #ring_852914446: NLH No Limit ($1/$2) - 2025/05/01 20:34:53
Table 'MR NLH 1/2' 7-max Seat #5 is the button
Seat 4: f3800e29 ($457.88 in chips)
Seat 5: 627c4124 ($248.76 in chips)
Seat 3: d8b54539 ($346.1 in chips)
Seat 2: Hero ($204 in chips)
Hero: posts small blind $1
d8b54539: posts big blind $2
*** HOLE CARDS ***
Dealt to f3800e29 
Dealt to 627c4124 
Dealt to d8b54539 
Dealt to Hero [Tc 8h]
f3800e29: folds
627c4124: raises $3 to $5
Hero: folds
d8b54539: calls $3
*** FLOP *** [Kh 5h Ad]
d8b54539: checks
627c4124: bets $3.74
d8b54539: calls $3.74
*** TURN *** [Kh 5h Ad] [9s]
d8b54539: checks
627c4124: checks
*** RIVER *** [Kh 5h Ad 9s] [3d]
d8b54539: checks
627c4124: checks
d8b54539: shows [Kc Ts]
627c4124: shows [6h 6d]
*** SHOWDOWN ***
d8b54539 collected $18.48 from pot
*** SUMMARY ***
Total pot $18.48
Board [Kh 5h Ad 9s 3d]
Seat 4: f3800e29 folded before Flop (didn't bet)
Seat 5: 627c4124 showed [6h 6d] and lost with Pair of Sixes
Seat 3: d8b54539(big blind) showed [Kc Ts] and won ($18.48) with Pair of Kings
Seat 2: Hero(small blind) folded before Flop



Poker Hand #ring_852913711: NLH No Limit ($1/$2) - 2025/05/01 20:34:24
Table 'MR NLH 1/2' 7-max Seat #4 is the button
Seat 4: f3800e29 ($457.88 in chips)
Seat 5: 627c4124 ($249.76 in chips)
Seat 3: d8b54539 ($343.32 in chips)
Seat 2: Hero ($206 in chips)
627c4124: posts small blind $1
Hero: posts big blind $2
*** HOLE CARDS ***
Dealt to f3800e29 
Dealt to 627c4124 
Dealt to d8b54539 
Dealt to Hero [Ah 6c]
d8b54539: calls $2
f3800e29: folds
627c4124: folds
Hero: checks
*** FLOP *** [2c Js 5c]
Hero: checks
d8b54539: bets $5
Hero: folds
Uncalled bet ($5) returned to d8b54539
*** SHOWDOWN ***
d8b54539 collected $5 from pot
*** SUMMARY ***
Total pot $5
Board [2c Js 5c]
Seat 4: f3800e29 folded before Flop (didn't bet)
Seat 5: 627c4124(small blind) folded before Flop
Seat 3: d8b54539won ($5) with King-High
Seat 2: Hero(big blind) folded on the Flop



