Poker Hand #ring_958575320: NLH No Limit ($1/$2) - 2025/06/27 03:10:16
Table 'MR NLH 1/2' 7-max Seat #6 is the button
Seat 6: b1cf3a7e ($286.18 in chips)
Seat 2: 745269fb ($229.46 in chips)
Seat 4: Hero ($171.62 in chips)
Seat 3: 8ab50fae ($539.36 in chips)
Seat 5: 2487fa48 ($44.28 in chips)
745269fb: posts small blind $1
8ab50fae: posts big blind $2
*** HOLE CARDS ***
Dealt to b1cf3a7e 
Dealt to 745269fb 
Dealt to Hero [Ac 6s]
Dealt to 8ab50fae 
Dealt to 2487fa48 
Hero: folds
2487fa48: folds
b1cf3a7e: raises $4 to $6
745269fb: folds
8ab50fae: folds
Uncalled bet ($4) returned to b1cf3a7e
*** SHOWDOWN ***
b1cf3a7e collected $5 from pot
*** SUMMARY ***
Total pot $5
Seat 6: b1cf3a7ewon ($5)
Seat 2: 745269fb(small blind) folded before Flop
Seat 4: Hero folded before Flop (didn't bet)
Seat 3: 8ab50fae(big blind) folded before Flop
Seat 5: 2487fa48 folded before Flop (didn't bet)



Poker Hand #ring_958574261: NLH No Limit ($1/$2) - 2025/06/27 03:09:30
Table 'MR NLH 1/2' 7-max Seat #5 is the button
Seat 6: b1cf3a7e ($232.66 in chips)
Seat 2: 745269fb ($231.46 in chips)
Seat 4: Hero ($197 in chips)
Seat 3: 8ab50fae ($564.74 in chips)
Seat 5: 2487fa48 ($49.28 in chips)
b1cf3a7e: posts small blind $1
745269fb: posts big blind $2
*** HOLE CARDS ***
Dealt to b1cf3a7e 
Dealt to 745269fb 
Dealt to Hero [2c 2h]
Dealt to 8ab50fae 
Dealt to 2487fa48 
8ab50fae: raises $3 to $5
Hero: calls $5
2487fa48: calls $5
b1cf3a7e: raises $20.38 to $25.38
745269fb: folds
8ab50fae: calls $20.38
Hero: calls $20.38
2487fa48: folds
*** FLOP *** [Ah Kd Qc]
b1cf3a7e: bets $41.57
8ab50fae: folds
Hero: folds
Uncalled bet ($41.57) returned to b1cf3a7e
*** SHOWDOWN ***
b1cf3a7e collected $83.14 from pot
*** SUMMARY ***
Total pot $83.14
Board [Ah Kd Qc]
Seat 6: b1cf3a7e(small blind)won ($83.14) with Pair of Aces and Pair of Kings
Seat 2: 745269fb(big blind) folded before Flop
Seat 4: Hero folded on the Flop
Seat 3: 8ab50fae folded on the Flop
Seat 5: 2487fa48 folded before Flop



Poker Hand #ring_958573534: NLH No Limit ($1/$2) - 2025/06/27 03:08:59
Table 'MR NLH 1/2' 7-max Seat #4 is the button
Seat 6: b1cf3a7e ($234.66 in chips)
Seat 1: 5f2dee4d ($500.52 in chips)
Seat 2: 745269fb ($231.46 in chips)
Seat 4: Hero ($197 in chips)
Seat 3: 8ab50fae ($561.74 in chips)
Seat 5: 2487fa48 ($50.28 in chips)
2487fa48: posts small blind $1
b1cf3a7e: posts big blind $2
*** HOLE CARDS ***
Dealt to b1cf3a7e 
Dealt to 5f2dee4d 
Dealt to 745269fb 
Dealt to Hero [3s 9h]
Dealt to 8ab50fae 
Dealt to 2487fa48 
5f2dee4d: folds
745269fb: folds
8ab50fae: raises $3 to $5
Hero: folds
2487fa48: folds
b1cf3a7e: folds
Uncalled bet ($3) returned to 8ab50fae
*** SHOWDOWN ***
8ab50fae collected $5 from pot
*** SUMMARY ***
Total pot $5
Seat 6: b1cf3a7e(big blind) folded before Flop
Seat 1: 5f2dee4d folded before Flop (didn't bet)
Seat 2: 745269fb folded before Flop (didn't bet)
Seat 4: Hero folded before Flop (didn't bet)
Seat 3: 8ab50faewon ($5)
Seat 5: 2487fa48(small blind) folded before Flop



Poker Hand #ring_958573050: NLH No Limit ($1/$2) - 2025/06/27 03:08:38
Table 'MR NLH 1/2' 7-max Seat #3 is the button
Seat 6: b1cf3a7e ($231.66 in chips)
Seat 1: 5f2dee4d ($500.52 in chips)
Seat 2: 745269fb ($231.46 in chips)
Seat 4: Hero ($198 in chips)
Seat 3: 8ab50fae ($561.74 in chips)
Seat 5: 2487fa48 ($52.28 in chips)
Hero: posts small blind $1
2487fa48: posts big blind $2
*** HOLE CARDS ***
Dealt to b1cf3a7e 
Dealt to 5f2dee4d 
Dealt to 745269fb 
Dealt to Hero [2s Qd]
Dealt to 8ab50fae 
Dealt to 2487fa48 
b1cf3a7e: raises $4 to $6
5f2dee4d: folds
745269fb: folds
8ab50fae: folds
Hero: folds
2487fa48: folds
Uncalled bet ($4) returned to b1cf3a7e
*** SHOWDOWN ***
b1cf3a7e collected $5 from pot
*** SUMMARY ***
Total pot $5
Seat 6: b1cf3a7ewon ($5)
Seat 1: 5f2dee4d folded before Flop (didn't bet)
Seat 2: 745269fb folded before Flop (didn't bet)
Seat 4: Hero(small blind) folded before Flop
Seat 3: 8ab50fae folded before Flop (didn't bet)
Seat 5: 2487fa48(big blind) folded before Flop



Poker Hand #ring_958571763: NLH No Limit ($1/$2) - 2025/06/27 03:07:43
Table 'MR NLH 1/2' 7-max Seat #2 is the button
Seat 6: b1cf3a7e ($231.66 in chips)
Seat 1: 5f2dee4d ($489.1 in chips)
Seat 2: 745269fb ($231.46 in chips)
Seat 4: Hero ($200 in chips)
Seat 3: 8ab50fae ($572.74 in chips)
Seat 5: 2487fa48 ($52.28 in chips)
8ab50fae: posts small blind $1
Hero: posts big blind $2
*** HOLE CARDS ***
Dealt to b1cf3a7e 
Dealt to 5f2dee4d 
Dealt to 745269fb 
Dealt to Hero [2d 6s]
Dealt to 8ab50fae 
Dealt to 2487fa48 
2487fa48: folds
b1cf3a7e: folds
5f2dee4d: raises $3 to $5
745269fb: folds
8ab50fae: calls $4
Hero: folds
*** FLOP *** [Jh 7d Kh]
8ab50fae: checks
5f2dee4d: bets $6
8ab50fae: calls $6
*** TURN *** [Jh 7d Kh] [6c]
8ab50fae: checks
5f2dee4d: bets $12
8ab50fae: folds
Uncalled bet ($12) returned to 5f2dee4d
*** SHOWDOWN ***
5f2dee4d collected $24 from pot
*** SUMMARY ***
Total pot $24
Board [Jh 7d Kh 6c]
Seat 6: b1cf3a7e folded before Flop (didn't bet)
Seat 1: 5f2dee4dwon ($24) with Pair of Kings and Pair of Jacks
Seat 2: 745269fb folded before Flop (didn't bet)
Seat 4: Hero(big blind) folded before Flop
Seat 3: 8ab50fae(small blind) folded on the Turn
Seat 5: 2487fa48 folded before Flop (didn't bet)



