Poker Hand #ring_827165665: NLH No Limit ($2/$4) - 2025/04/17 01:25:10
Table 'MR NLH 2/4' 7-max Seat #3 is the button
Seat 1: 2da45b6 ($537.15 in chips)
Seat 4: Hero ($363 in chips)
Seat 3: cac976ba ($809.25 in chips)
Seat 5: 3832fc71 ($822.38 in chips)
Hero: posts small blind $2
3832fc71: posts big blind $4
*** HOLE CARDS ***
Dealt to 2da45b6 
Dealt to Hero [7c Ac]
Dealt to cac976ba 
Dealt to 3832fc71 
2da45b6: folds
cac976ba: folds
Hero: raises $6 to $10
3832fc71: calls $6
*** FLOP *** [5c 3s 5s]
Hero: checks
3832fc71: bets $15
Hero: calls $15
*** TURN *** [5c 3s 5s] [7d]
Hero: checks
3832fc71: bets $74
Hero: calls $74
*** RIVER *** [5c 3s 5s 7d] [Ah]
Hero: checks
3832fc71: bets $364
Hero: calls $264 and is all-in
Uncalled bet ($100) returned to 3832fc71
Hero: shows [7c Ac]
3832fc71: shows [5h 9h]
*** SHOWDOWN ***
3832fc71 collected $726 from pot
*** SUMMARY ***
Total pot $726
Board [5c 3s 5s 7d Ah]
Seat 1: 2da45b6 folded before Flop (didn't bet)
Seat 4: Hero(small blind) showed [7c Ac] and lost with Pair of Aces and Pair of Sevens
Seat 3: cac976ba folded before Flop (didn't bet)
Seat 5: 3832fc71(big blind) showed [5h 9h] and won ($726) with Three Fives



Poker Hand #ring_827164610: NLH No Limit ($2/$4) - 2025/04/17 01:24:32
Table 'MR NLH 2/4' 7-max Seat #1 is the button
Seat 1: 2da45b6 ($517.13 in chips)
Seat 4: Hero ($384 in chips)
Seat 3: cac976ba ($811.25 in chips)
Seat 5: 3832fc71 ($822.38 in chips)
cac976ba: posts small blind $2
Hero: posts big blind $4
*** HOLE CARDS ***
Dealt to 2da45b6 
Dealt to Hero [4d 6s]
Dealt to cac976ba 
Dealt to 3832fc71 
3832fc71: folds
2da45b6: raises $6 to $10
cac976ba: folds
Hero: calls $6
*** FLOP *** [7s Qh Tc]
Hero: bets $11
2da45b6: calls $11
*** TURN *** [7s Qh Tc] [2s]
Hero: checks
2da45b6: bets $22
Hero: folds
Uncalled bet ($22) returned to 2da45b6
*** SHOWDOWN ***
2da45b6 collected $44 from pot
*** SUMMARY ***
Total pot $44
Board [7s Qh Tc 2s]
Seat 1: 2da45b6won ($44) with Queen-High
Seat 4: Hero(big blind) folded on the Turn
Seat 3: cac976ba(small blind) folded before Flop
Seat 5: 3832fc71 folded before Flop (didn't bet)



Poker Hand #ring_827164149: NLH No Limit ($2/$4) - 2025/04/17 01:24:13
Table 'MR NLH 2/4' 7-max Seat #5 is the button
Seat 1: 2da45b6 ($503.13 in chips)
Seat 4: Hero ($394 in chips)
Seat 3: cac976ba ($815.25 in chips)
Seat 5: 3832fc71 ($822.38 in chips)
2da45b6: posts small blind $2
cac976ba: posts big blind $4
*** HOLE CARDS ***
Dealt to 2da45b6 
Dealt to Hero [Qd Jc]
Dealt to cac976ba 
Dealt to 3832fc71 
Hero: raises $6 to $10
3832fc71: folds
2da45b6: raises $30 to $40
cac976ba: folds
Hero: folds
Uncalled bet ($30) returned to 2da45b6
*** SHOWDOWN ***
2da45b6 collected $24 from pot
*** SUMMARY ***
Total pot $24
Seat 1: 2da45b6(small blind)won ($24)
Seat 4: Hero folded before Flop
Seat 3: cac976ba(big blind) folded before Flop
Seat 5: 3832fc71 folded before Flop (didn't bet)



Poker Hand #ring_827163443: NLH No Limit ($2/$4) - 2025/04/17 01:23:48
Table 'MR NLH 2/4' 7-max Seat #4 is the button
Seat 1: 2da45b6 ($507.13 in chips)
Seat 4: Hero ($394 in chips)
Seat 3: cac976ba ($825.25 in chips)
Seat 5: 3832fc71 ($808.38 in chips)
3832fc71: posts small blind $2
2da45b6: posts big blind $4
*** HOLE CARDS ***
Dealt to 2da45b6 
Dealt to Hero [6c 2c]
Dealt to cac976ba 
Dealt to 3832fc71 
cac976ba: raises $6 to $10
Hero: folds
3832fc71: raises $30 to $40
2da45b6: folds
cac976ba: folds
Uncalled bet ($30) returned to 3832fc71
*** SHOWDOWN ***
3832fc71 collected $24 from pot
*** SUMMARY ***
Total pot $24
Seat 1: 2da45b6(big blind) folded before Flop
Seat 4: Hero folded before Flop (didn't bet)
Seat 3: cac976ba folded before Flop
Seat 5: 3832fc71(small blind)won ($24)



Poker Hand #ring_827162795: NLH No Limit ($2/$4) - 2025/04/17 01:23:24
Table 'MR NLH 2/4' 7-max Seat #3 is the button
Seat 1: 2da45b6 ($496.12 in chips)
Seat 4: Hero ($396 in chips)
Seat 3: cac976ba ($825.25 in chips)
Seat 5: 3832fc71 ($818.38 in chips)
Hero: posts small blind $2
3832fc71: posts big blind $4
*** HOLE CARDS ***
Dealt to 2da45b6 
Dealt to Hero [9s 2c]
Dealt to cac976ba 
Dealt to 3832fc71 
2da45b6: raises $6 to $10
cac976ba: folds
Hero: folds
3832fc71: calls $6
*** FLOP *** [3h Kc Qh]
3832fc71: checks
2da45b6: bets $11
3832fc71: folds
Uncalled bet ($11) returned to 2da45b6
*** SHOWDOWN ***
2da45b6 collected $22 from pot
*** SUMMARY ***
Total pot $22
Board [3h Kc Qh]
Seat 1: 2da45b6won ($22) with Pair of Kings
Seat 4: Hero(small blind) folded before Flop
Seat 3: cac976ba folded before Flop (didn't bet)
Seat 5: 3832fc71(big blind) folded on the Flop



Poker Hand #ring_827162319: NLH No Limit ($2/$4) - 2025/04/17 01:23:07
Table 'MR NLH 2/4' 7-max Seat #1 is the button
Seat 1: 2da45b6 ($496.12 in chips)
Seat 4: Hero ($400 in chips)
Seat 3: cac976ba ($821.61 in chips)
Seat 5: 3832fc71 ($818.38 in chips)
cac976ba: posts small blind $2
Hero: posts big blind $4
*** HOLE CARDS ***
Dealt to 2da45b6 
Dealt to Hero [3s 4h]
Dealt to cac976ba 
Dealt to 3832fc71 
3832fc71: folds
2da45b6: folds
cac976ba: calls $2
Hero: checks
*** FLOP *** [Ks 7h Qd]
cac976ba: bets $4
Hero: folds
Uncalled bet ($4) returned to cac976ba
*** SHOWDOWN ***
cac976ba collected $8 from pot
*** SUMMARY ***
Total pot $8
Board [Ks 7h Qd]
Seat 1: 2da45b6 folded before Flop (didn't bet)
Seat 4: Hero(big blind) folded on the Flop
Seat 3: cac976ba(small blind)won ($8) with King-High
Seat 5: 3832fc71 folded before Flop (didn't bet)



