Poker Hand #ring_831849838: NLH No Limit ($1/$2) - 2025/04/19 20:29:03
Table 'MR NLH 1/2' 7-max Seat #2 is the button
Seat 6: 5fd72d50 ($402.43 in chips)
Seat 2: Hero ($23.6 in chips)
Hero: posts small blind $1
5fd72d50: posts big blind $2
*** HOLE CARDS ***
Dealt to 5fd72d50 
Dealt to Hero [Jc Ac]
Hero: raises $3 to $5
5fd72d50: raises $397.43 to $402.43 and is all-in
Hero: calls $18.6 and is all-in
Uncalled bet ($378.83) returned to 5fd72d50
Hero: shows [Jc Ac]
5fd72d50: shows [Qh Kh]
*** FLOP *** [5s 7s 3h]
*** TURN *** [5s 7s 3h] [2d]
*** RIVER *** [5s 7s 3h 2d] [Kd]
*** SHOWDOWN ***
5fd72d50 collected $47.2 from pot
*** SUMMARY ***
Total pot $47.2
Board [5s 7s 3h 2d Kd]
Seat 6: 5fd72d50(big blind) showed [Qh Kh] and won ($47.2) with Pair of Kings
Seat 2: Hero(small blind) showed [Jc Ac] and lost with Ace-High



Poker Hand #ring_831849547: NLH No Limit ($1/$2) - 2025/04/19 20:28:51
Table 'MR NLH 1/2' 7-max Seat #0 is the button
Seat 6: 5fd72d50 ($403.43 in chips)
Seat 2: Hero ($22.6 in chips)
5fd72d50: posts small blind $1
Hero: posts big blind $2
*** HOLE CARDS ***
Dealt to 5fd72d50 
Dealt to Hero [9s 3d]
5fd72d50: folds
*** SHOWDOWN ***
Hero collected $3 from pot
*** SUMMARY ***
Total pot $3
Seat 6: 5fd72d50(small blind) folded before Flop
Seat 2: Hero(big blind)won ($3)



Poker Hand #ring_831848221: NLH No Limit ($1/$2) - 2025/04/19 20:27:53
Table 'MR NLH 1/2' 7-max Seat #2 is the button
Seat 6: 5fd72d50 ($332.37 in chips)
Seat 2: Hero ($97 in chips)
5fd72d50: posts big blind $2
*** HOLE CARDS ***
Dealt to 5fd72d50 
Dealt to Hero [Jc 9h]
Hero: raises $3 to $5
5fd72d50: calls $3
*** FLOP *** [3s Tc 5s]
5fd72d50: checks
Hero: checks
*** TURN *** [3s Tc 5s] [8s]
5fd72d50: bets $10
Hero: calls $10
*** RIVER *** [3s Tc 5s 8s] [5d]
5fd72d50: bets $22.2
Hero: raises $37.2 to $59.4
5fd72d50: calls $37.2
Hero: shows [Jc 9h]
5fd72d50: shows [Td Ac]
*** SHOWDOWN ***
5fd72d50 collected $148.8 from pot
*** SUMMARY ***
Total pot $148.8
Board [3s Tc 5s 8s 5d]
Seat 6: 5fd72d50(big blind) showed [Td Ac] and won ($148.8) with Pair of Tens and Pair of Fives
Seat 2: Hero showed [Jc 9h] and lost with Pair of Fives



Poker Hand #ring_831846955: NLH No Limit ($1/$2) - 2025/04/19 20:26:57
Table 'MR NLH 1/2' 7-max Seat #6 is the button
Seat 6: 5fd72d50 ($226.47 in chips)
Seat 3: ac819013 ($115.32 in chips)
Seat 2: Hero ($98 in chips)
Hero: posts small blind $1
ac819013: posts big blind $2
*** HOLE CARDS ***
Dealt to 5fd72d50 
Dealt to ac819013 
Dealt to Hero [5d 8c]
5fd72d50: raises $3 to $5
Hero: folds
ac819013: raises $11 to $16
5fd72d50: raises $20 to $36
ac819013: raises $79.32 to $115.32 and is all-in
5fd72d50: calls $79.32
ac819013: shows [6h 6c]
5fd72d50: shows [Kd Ks]
*** FLOP *** [5s Ac Tc]
*** TURN *** [5s Ac Tc] [7c]
*** RIVER *** [5s Ac Tc 7c] [3h]
*** SHOWDOWN ***
5fd72d50 collected $231.64 from pot
*** SUMMARY ***
Total pot $231.64
Board [5s Ac Tc 7c 3h]
Seat 6: 5fd72d50 showed [Kd Ks] and won ($231.64) with Pair of Kings
Seat 3: ac819013(big blind) showed [6h 6c] and lost with Pair of Sixes
Seat 2: Hero(small blind) folded before Flop



Poker Hand #ring_831846415: NLH No Limit ($1/$2) - 2025/04/19 20:26:34
Table 'MR NLH 1/2' 7-max Seat #3 is the button
Seat 6: 5fd72d50 ($224.47 in chips)
Seat 3: ac819013 ($115.32 in chips)
Seat 2: Hero ($100 in chips)
5fd72d50: posts small blind $1
Hero: posts big blind $2
*** HOLE CARDS ***
Dealt to 5fd72d50 
Dealt to ac819013 
Dealt to Hero [Th 4h]
ac819013: folds
5fd72d50: raises $4 to $6
Hero: folds
Uncalled bet ($4) returned to 5fd72d50
*** SHOWDOWN ***
5fd72d50 collected $4 from pot
*** SUMMARY ***
Total pot $4
Seat 6: 5fd72d50(small blind)won ($4)
Seat 3: ac819013 folded before Flop (didn't bet)
Seat 2: Hero(big blind) folded before Flop



Poker Hand #ring_831845672: NLH No Limit ($1/$2) - 2025/04/19 20:26:03
Table 'MR NLH 1/2' 7-max Seat #2 is the button
Seat 6: 5fd72d50 ($226.47 in chips)
Seat 3: ac819013 ($113.32 in chips)
Seat 2: Hero ($100 in chips)
ac819013: posts small blind $1
5fd72d50: posts big blind $2
*** HOLE CARDS ***
Dealt to 5fd72d50 
Dealt to ac819013 
Dealt to Hero [Js 4c]
Hero: folds
ac819013: raises $4 to $6
5fd72d50: folds
Uncalled bet ($4) returned to ac819013
*** SHOWDOWN ***
ac819013 collected $4 from pot
*** SUMMARY ***
Total pot $4
Seat 6: 5fd72d50(big blind) folded before Flop
Seat 3: ac819013(small blind)won ($4)
Seat 2: Hero folded before Flop (didn't bet)



Poker Hand #ring_831845365: NLH No Limit ($1/$2) - 2025/04/19 20:25:51
Table 'MR NLH 1/2' 7-max Seat #2 is the button
Seat 3: ac819013 ($115.32 in chips)
Seat 2: Hero ($98 in chips)
Hero: posts small blind $1
ac819013: posts big blind $2
*** HOLE CARDS ***
Dealt to ac819013 
Dealt to Hero [7d 5s]
Hero: raises $3 to $5
ac819013: folds
Uncalled bet ($3) returned to Hero
*** SHOWDOWN ***
Hero collected $4 from pot
*** SUMMARY ***
Total pot $4
Seat 3: ac819013(big blind) folded before Flop
Seat 2: Hero(small blind)won ($4)



Poker Hand #ring_831845088: NLH No Limit ($1/$2) - 2025/04/19 20:25:38
Table 'MR NLH 1/2' 7-max Seat #3 is the button
Seat 3: ac819013 ($113.32 in chips)
Seat 2: Hero ($100 in chips)
ac819013: posts small blind $1
Hero: posts big blind $2
*** HOLE CARDS ***
Dealt to ac819013 
Dealt to Hero [4h 8d]
ac819013: raises $2 to $4
Hero: folds
Uncalled bet ($2) returned to ac819013
*** SHOWDOWN ***
ac819013 collected $4 from pot
*** SUMMARY ***
Total pot $4
Seat 3: ac819013(small blind)won ($4)
Seat 2: Hero(big blind) folded before Flop



